"doc.id","title","citeulike.id","raw.title","raw.abstract"
65,"engineering stability in gene networks by autoregulation",314,"Engineering stability in gene networks by autoregulation.","The genetic and biochemical networks which underlie such things as homeostasis in metabolism and the developmental programs of living cells, must withstand considerable variations and random perturbations of biochemical parameters. {T}hese occur as transient changes in, for example, transcription, translation, and {RNA} and protein degradation. {T}he intensity and duration of these perturbations differ between cells in a population. {T}he unique state of cells, and thus the diversity in a population, is owing to the different environmental stimuli the individual cells experience and the inherent stochastic nature of biochemical processes (for example, refs 5 and 6). {I}t has been proposed, but not demonstrated, that autoregulatory, negative feedback loops in gene circuits provide stability, thereby limiting the range over which the concentrations of network components fluctuate. {H}ere we have designed and constructed simple gene circuits consisting of a regulator and transcriptional repressor modules in {E}scherichia coli and we show the gain of stability produced by negative feedback."
66,"a functional genomics strategy that uses metabolome data to reveal the phenotype of silent mutations",326,"A functional genomics strategy that uses metabolome data to reveal the phenotype of silent mutations.","A large proportion of the 6,000 genes present in the genome of Saccharomyces cerevisiae, and of those sequenced in other organisms, encode proteins of unknown function. Many of these genes are ""silent,"" that is, they show no overt phenotype, in terms of growth rate or other fluxes, when they are deleted from the genome. We demonstrate how the intracellular concentrations of metabolites can reveal phenotypes for proteins active in metabolic regulation. Quantification of the change of several metabolite concentrations relative to the concentration change of one selected metabolite can reveal the site of action, in the metabolic network, of a silent gene. In the same way, comprehensive analyses of metabolite concentrations in mutants, providing ""metabolic snapshots,"" can reveal functions when snapshots from strains deleted for unstudied genes are compared to those deleted for known genes. This approach to functional analysis, using comparative metabolomics, we call FANCY—an abbreviation for functional analysis by co-responses in yeast."
67,"document coorganization in an online knowledge community",431,"Document co-organization in an online knowledge community","We introduce the concept of ""document co-organization"" and describe such a system. By document co-organization we mean that individuals are allowed to hierarchically organize documents personally and share their hierarchies with others, while the system generates a ""consensus"" hierarchy from these personal hierarchies, which provides a full, common, and emergent view of all documents. By allowing users to retrieve documents from their own organization (hierarchy), another user's, the consensus hierarchy, or a time-based hierarchy, we provide access corresponding to different characteristics of knowledge tasks: they are personal, collective, social, and time-sensitive. In a class website experiment, we show that for a complex knowledge task, hierarchies are used more frequently than search. One surprising finding is how often students use others' personal hierarchies."
68,"inferring web communities from link topology",444,"Inferring Web Communities from Link Topology","dag&amp;x.berkeley.edu kleinberQcs.cornell.edu The World Wide Web grows through a decentralized, almost anarchic process, and this has resulted in a large hyperlinked corpus without the kind of logical organiza-tion that can be built into more tradit,ionally-created hy-permedia. To extract, meaningful structure under such circumstances, we develop a notion of hyperlinked com-munities on the www t,hrough an analysis of the link topology. By invoking a simple, mathematically clean method for defining and exposing the structure of these communities, we are able to derive a number of themes: The communities can be viewed as containing a core of central, “authoritative ” pages linked tog&amp;her by “hub pages ” ; and they exhibit a natural type of hierarchical topic generalization that can be inferred directly from the pat,t,ern of linkage. Our investigation shows that al-though the process by which users of the Web create pages and links is very difficult to understand at a “lo-cal ” level, it results in a much greater degree of orderly high-level structure than has typically been assumed."
69,"footprints historyrich tools for information foraging",446,"Footprints: History-Rich Tools for Information Foraging","Inspired by Hill and Hollan's original work [6], we have been developing a theory of interaction history and building tools to apply this theory to navigation in a complex information space. We have built a series of tools --- map, trails, annotations and signposts --- based on a physical-world navigation metaphor. These tools have been in use for over a year. Our user study involved a controlled browse task and showed that users were able to get the same amount of work done with significantly less effort."
70,"information foraging",448,"Information foraging","Information foraging theory is an approach to understanding how strategies and technologies for information seeking, gathering, and consumption are adapted to the flux of information in the environment. The theory assumes that people, when possible, will modify their strategies or the structure of the environment to maximize their rate of gaining valuable information. The theory is developed by (a) adaptation (rational) analysis of information foraging problems and (b) a detailed process model (adaptive control of thought in information foraging [ACT-IF]). The adaptation analysis develops (a) information patch models, which deal with time allocation and information filtering and enrichment activities in environments in which information is encountered in clusters; (b) information scent models, which address the identification of information value from proximal cues; and (c) information diet models, which address decisions about the selection and pursuit of information items. ACT-IF is instantiated as a production system model of people interacting with complex information technology. Humans actively seek, gather, share, and consume information to a degree unapproached by other organisms. Ours might properly be characterized as a species of informavores (Dennett, 1991). Our adaptive success depends to a large extent on a vast and complex"
71,"exploiting generative models in discriminative classifiers",449,"Exploiting generative models in discriminative classifiers","Generative probability models such as hidden Markov models providea principled way of treating missing information and dealingwith variable length sequences. On the other hand, discriminativemethods such as support vector machines enable us to constructflexible decision boundaries and often result in classification performancesuperior to that of the model based approaches. An idealclassifier should combine these two complementary approaches. Inthis paper, we develop a natural way of achieving this combinationby deriving kernel functions for use in discriminative methodssuch as support vector machines from generative probability models.We provide a theoretical justification for this combination aswell as demonstrate a substantial improvement in the classificationperformance in the context of DNA and protein sequence analysis.1 IntroductionSpeech, vision, text and biosequence data can be difficult to deal with in the contextof simple statistical classification problems. B..."
72,"spreading activation models for trust propagation",457,"Spreading Activation Models for Trust Propagation","Semantic Web endeavors have mainly focused on issues pertaining to knowledge representation and ontology design. However, besides understanding information metadata stated by subjects, knowing about their credibility becomes equally crucial. Hence, trust and trust metrics, conceived as computational means to evaluate trust relationships between individuals, come into play. Our major contributions to semantic Web trust management are twofold. First, we introduce our classification scheme for trust metrics along various axes and discuss advantages and drawbacks of existing approaches for semantic Web scenarios. Hereby, we devise our advocacy for local group trust metrics, guiding us to the second part which presents Appleseed, our novel proposal for local group trust computation. Compelling in its simplicity, Appleseed borrows many ideas from spreading activation models in psychology and relates their concepts to trust evaluation in an intuitive fashion."
73,"design and implementation of microarray gene expression markup language mageml",459,"Design and implementation of microarray gene expression markup language (MAGE-ML).","BACKGROUND: Meaningful exchange of microarray data is currently difficult because it is rare that published data provide sufficient information depth or are even in the same format from one publication to another. Only when data can be easily exchanged will the entire biological community be able to derive the full benefit from such microarray studies. RESULTS: To this end we have developed three key ingredients towards standardizing the storage and exchange of microarray data. First, we have created a minimal information for the annotation of a microarray experiment (MIAME)-compliant conceptualization of microarray experiments modeled using the unified modeling language (UML) named MAGE-OM (microarray gene expression object model). Second, we have translated MAGE-OM into an XML-based data format, MAGE-ML, to facilitate the exchange of data. Third, some of us are now using MAGE (or its progenitors) in data production settings. Finally, we have developed a freely available software tool kit (MAGE-STK) that eases the integration of MAGE-ML into end users' systems. CONCLUSIONS: MAGE will help microarray data producers and users to exchange information by providing a common platform for data exchange, and MAGE-STK will make the adoption of MAGE easier."
74,"network reachability of realworld contact sequences",482,"Network reachability of real-world contact sequences","We use real-world contact sequences, time-ordered lists of contacts from one person to another, to study how fast information or disease can spread across network of contacts. Specifically we measure the reachability time -- the average shortest time for a series of contacts to spread information between a reachable pair of vertices (a pair where a chain of contacts exists leading from one person to the other) -- and the reachability ratio -- the fraction of reachable vertex pairs. These measures are studied using conditional uniform graph tests. We conclude, among other things, that the network reachability depends much on a core where the path lengths are short and communication frequent, that clustering of the contacts of an edge in time tend to decrease the reachability, and that the order of the contacts really do make sense for dynamical spreading processes."
75,"a theory of problemsolving behavior",487,"A Theory of Problem-Solving Behavior","In this paper we develop a formal, testable theory of problem-solving behavior with special relevance to individuals and small groups. The theory is consistent with principles drawn from operant behavior and social exchange theories but also incorporates elements of cognitive psychology. Problem solving is defined as a nonroutine activity oriented toward changing an undesirable state of affairs. The focus on change differentiates problem solving from coping, which is oriented toward relieving feelings of stress. A decision-making model is presented, which takes the problem-solving process through its latter stages. The theory is based on two axioms and three theorems pertaining to the process of decision making. These axioms and theorems serve as the foundation for deriving 14 theorems that establish the antecedent conditions affecting decisions relevnat to each of four stages in the problem-solving process. This theory is distinguished from other problem-solving theories in its effort to account for conditions leading to awareness of problems and in its emphasis on generic problem-solving processes rather than on the effectiveness of problem-solving outcomes."
76,"sticky information and the locus of problem solving implications for innovation",490,"Sticky Information and the Locus of Problem Solving: Implications for Innovation","To solve a problem, needed information and problem-solving capabilities must be brought together. Often the information used in technical problem solving is costly to acquire, transfer, and use in a new location-is, in our terms, sticky. In this paper we explore the impact of information stickiness on the locus of innovation-related problem solving. We find, first, that when sticky information needed by problem solvers is held at one site only, problem solving will be carried out at that locus, other things being equal. Second, when more than one locus of sticky information is called upon by problem solvers, the locus of problem solving may iterate among these sites as problem solving proceeds. When the costs of such iteration are high, then, third, problems that draw upon multiple sites of sticky information will sometimes be task partitioned into subproblems that each draw on only one such locus, and/or, fourth, investments will be made to reduce the stickiness of information at some locations. Information stickiness appears to affect a number of issues of importance to researchers and practitioners. Among these are patterns in the diffusion of information, the specialization of firms, the locus of innovation, and the nature of problems selected by problem solvers."
77,"information diffusion through blogspace",491,"Information diffusion through blogspace","We study the dynamics of information propagation in environments of low-overhead personal publishing, using a large collection of weblogs over time as our example domain. We characterize and model this collection at two levels. First, we present a macroscopic characterization of topic propagation through our corpus, formalizing the notion of long-running “chatter” topics consisting recursively of “spike” topics generated by outside world events, or more rarely, by resonances within the community. Second, we present a microscopic characterization of propagation from individual to individual, drawing on the theory of infectious diseases to model the flow. We propose, validate, and employ an algorithm to induce the underlying propagation network from a sequence of posts, and report on the results."
78,"problems with fitting to the powerlaw distribution",492,"Problems with Fitting to the Power-Law Distribution","Abstract. This short communication uses a simple experiment to show that fitting to a power law distribution by using graphical methods based on linear fit on the log-log scale is biased and inaccurate. It shows that using maximum likelihood estimation (MLE) is far more robust. Finally, it presents a new table for performing the Kolmogorov-Smirnov test for goodness-of-fit tailored to power-law distributions in which the power-law exponent is estimated using MLE. The techniques presented here will advance the application of complex network theory by allowing reliable estimation of power-law models from data and further allowing quantitative assessment of goodness-of-fit of proposed power-law models to empirical data. PACS. 02.50.Ng Distribution theory and Monte Carlo studies -- 05.10.Ln Monte Carlo methods -- 89.75.-k"
79,"the shortest path to complex networks",494,"The shortest path to complex networks","1. The birth of network science. 2. What are random networks? 3. Adjacency matrix. 4. Degree distribution. 5. What are simple networks? Classical random graphs. 6. Birth of the giant component. 7. Topology of the Web. 8.Uncorrelated networks. 9. What are small worlds? 10. Real networks are mesoscopic objects. 11. What are complex networks? 12. The configuration model. 13. The absence of degree--degree correlations. 14.Networks with correlated degrees.15.Clustering. 16. What are small-world networks? 17. `Small worlds' is not the same as `small-world networks'. 18. Fat-tailed degree distributions. 19.Reasons for the fat-tailed degree distributions. 20. Preferential linking. 21. Condensation of edges. 22. Cut-offs of degree distributions. 23. Reasons for correlations in networks. 24. Classical random graphs cannot be used for comparison with real networks. 25. How to measure degree--degree correlations. 26. Assortative and disassortative mixing. 27. Disassortative mixing does not mean that vertices of high degrees rarely connect to each other. 28. Reciprocal links in directed nets. 29. Ultra-small-world effect. 30. Tree ansatz. 31.Ultraresilience against random failures. 32. When correlated nets are ultraresilient. 33. Vulnerability of complex networks. 34. The absence of an epidemic threshold. 35. Search based on local information. 36.Ultraresilience disappears in finite nets. 37.Critical behavior of cooperative models on networks. 38. Berezinskii-Kosterlitz-Thouless phase transitions in networks. 39.Cascading failures. 40.Cliques &amp; communities. 41. Betweenness. 42.Extracting communities. 43. Optimal paths. 44.Distributions of the shortest-path length &amp; of the loop's length are narrow. 45. Diffusion on networks. 46. What is modularity? 47.Hierarchical organization of networks. 48. Convincing modelling of real-world networks:Is it possible? 49. The small Web.."
80,"coevolution of dynamical states and interactions in dynamic networks",496,"Coevolution of dynamical states and interactions in dynamic networks","We explore the coupled dynamics of the internal states of a set of interacting elements and the network of interactions among them. Interactions are modeled by a spatial game and the network of interaction links evolves adapting to the outcome of the game. As an example, we consider a model of cooperation in which the adaptation is shown to facilitate the formation of a hierarchical interaction network that sustains a highly cooperative stationary state. The resulting network has the characteristics of a small world network when a mechanism of local neighbor selection is introduced in the adaptive network dynamics. The highly connected nodes in the hierarchical structure of the network play a leading role in the stability of the network. Perturbations acting on the state of these special nodes trigger global avalanches leading to complete network reorganization."
81,"coarsegraining and selfdissimilarity of complex networks",500,"Coarse-Graining and Self-Dissimilarity of Complex Networks","Can complex engineered and biological networks be coarse-grained into smaller and more understandable versions in which each node represents an entire pattern in the original network? To address this, we define coarse-graining units as connectivity patterns which can serve as the nodes of a coarse-grained network and present algorithms to detect them. We use this approach to systematically reverse-engineer electronic circuits, forming understandable high-level maps from incomprehensible transistor wiring: first, a coarse-grained version in which each node is a gate made of several transistors is established. Then the coarse-grained network is itself coarse-grained, resulting in a high-level blueprint in which each node is a circuit module made of many gates. We apply our approach also to a mammalian protein signal-transduction network, to find a simplified coarse-grained network with three main signaling channels that resemble multi-layered perceptrons made of cross-interacting MAP-kinase cascades. We find that both biological and electronic networks are ""self-dissimilar,"" with different network motifs at each level. The present approach may be used to simplify a variety of directed and nondirected, natural and designed networks."
82,"mips a database for genomes and protein sequences",501,"MIPS: a database for genomes and protein sequences","The Munich Information Center for Protein Sequences (MIPS-GSF, Neuherberg, Germany) continues to provide genome-related information in a systematic way. MIPS supports both national and European sequencing and functional analysis projects, develops and maintains automatically generated and manually annotated genome-specific databases, develops systematic classification schemes for the functional annotation of protein sequences, and provides tools for the comprehensive analysis of protein sequences. This report updates the information on the yeast genome (CYGD), the Neurospora crassa genome (MNCDB), the databases for the comprehensive set of genomes (PEDANT genomes), the database of annotated human EST clusters (HIB), the database of complete cDNAs from the DHGP (German Human Genome Project), as well as the project specific databases for the GABI (Genome Analysis in Plants) and HNB (Helmholtz-Netzwerk Bioinformatik) networks. The Arabidospsis thaliana database (MATDB), the database of mitochondrial proteins (MITOP) and our contribution to the PIR International Protein Sequence Database have been described elsewhere [Schoof et al. (2002) Nucleic Acids Res., 30, 91-93; Scharfe et al. (2000) Nucleic Acids Res., 28, 155-158; Barker et al. (2001) Nucleic Acids Res., 29, 29-32]. All databases described, the protein analysis tools provided and the detailed descriptions of our projects can be accessed through the MIPS World Wide Web server (http://mips.gsf.de)."
83,"mips analysis and annotation of proteins from whole genomes",509,"MIPS: analysis and annotation of proteins from whole genomes","The Munich Information Center for Protein Sequences (MIPSâGSF), Neuherberg, Germany, provides protein sequenceârelated information based on wholeâgenome analysis. The main focus of the work is directed toward the systematic organization of sequenceârelated attributes as gathered by a variety of algorithms, primary information from experimental data together with information compiled from the scientific literature. MIPS maintains automatically generated and manually annotated genomeâspecific databases, develops systematic classification schemes for the functional annotation of protein sequences and provides tools for the comprehensive analysis of protein sequences. This report updates the information on the yeast genome (CYGD), the Neurospora crassa genome (MNCDB), the database of complete cDNAs (German Human Genome Project, NGFN), the database of mammalian proteinâprotein interactions (MPPI), the database of FASTA homologies (SIMAP), and the interface for the fast retrieval of proteinâassociated information (QUIPOS). The Arabidopsis thaliana database, the rice database, the plant EST databases (MATDB, MOsDB, SPUTNIK), as well as the databases for the comprehensive set of genomes (PEDANT genomes) are described elsewhere in the 2003 and 2004 NAR database issues, respectively. All databases described, and the detailed descriptions of our projects can be accessed through the MIPS web server (http://mips.gsf.de)."
84,"evolving a stigmergic selforganized datamining",514,"Evolving a Stigmergic Self-Organized Data-Mining","Self-organizing complex systems typically are comprised of a large number of frequently similar components or events. Through their process, a pattern at the global-level of a system emerges solely from numerous interactions among the lower-level components of the system. Moreover, the rules specifying interactions among the system’s components are executed using only local information, without reference to the global pattern, which, as in many real-world problems is not easily accessible or possible to be found. Stigmergy, a kind of indirect communication and learning by the environment found in social insects is a well know example of self-organization, providing not only vital clues in order to understand how the components can interact to produce a complex pattern, as can pinpoint simple biological non-linear rules and methods to achieve improved artificial intelligent adaptive categorization systems, critical for Data-Mining. On the present work it is our intention to show that a new type of Data-Mining can be designed based on Stigmergic paradigms, taking profit of several natural features of this phenomenon. By hybridizing bio-inspired Swarm Intelligence with Evolutionary Computation we seek for an entire distributed, adaptive, collective and cooperative self-organized Data-Mining. As a real-world/real-time test bed for our proposal, World-Wide-Web Mining will be used.  Having that purpose in mind, Web usage Data was collected from the Monash University’s Web site (Australia), with over 7 million hits every week. Results are compared to other recent systems, showing that the system presented is by far promising."
