"doc.id","title","citeulike.id","raw.title","raw.abstract"
22,"growing and navigating the small world web by local content",127,"Growing and navigating the small world Web by local content.","Can we model the scale-free distribution of Web hypertext degree under realistic assumptions about the behavior of page authors? Can a Web crawler efficiently locate an unknown relevant page? These questions are receiving much attention due to their potential impact for understanding the structure of the Web and for building better search engines. Here I investigate the connection between the linkage and content topology of Web pages. The relationship between a text-induced distance metric and a link-based neighborhood probability distribution displays a phase transition between a region where linkage is not determined by content and one where linkage decays according to a power law. This relationship is used to propose a Web growth model that is shown to accurately predict the distribution of Web page degree, based on textual content and assuming only local knowledge of degree for existing pages. A qualitatively similar phase transition is found between linkage and semantic distance, with an exponential decay tail. Both relationships suggest that efficient paths can be discovered by decentralized Web navigation algorithms based on textual and/or categorical cues."
23,"the structure of scientific collaboration networks",128,"The structure of scientific collaboration networks","The structure of scientific collaboration networks is investigated. Two scientists are considered connected if they have authored a paper together and explicit networks of such connections are constructed by using data drawn from a number of databases, including MEDLINE (biomedical research), the Los Alamos e-Print Archive (physics), and NCSTRL (computer science). I show that these collaboration networks form âsmall worlds,â in which randomly chosen pairs of scientists are typically separated by only a short path of intermediate acquaintances. I further give results for mean and distribution of numbers of collaborators of authors, demonstrate the presence of clustering in the networks, and highlight a number of apparent differences in the patterns of collaboration between the fields studied."
24,"classes of smallworld networks",129,"Classes of small-world networks","We study the statistical properties of a variety of diverse real-world networks. We present evidence of the occurrence of three classes of small-world networks: (a) scale-free networks, characterized by a vertex connectivity distribution that decays as a power law; (b) broad-scale networks, characterized by a connectivity distribution that has a power law regime followed by a sharp cutoff; and (c) single-scale networks, characterized by a connectivity distribution with a fast decaying tail. Moreover. we note for the classes of broad-scale and single-scale networks that there are constraints limiting the addition of new links. Our results suggest that the nature of such constraints may be the controlling factor for the emergence of different classes of networks."
25,"spectra of realworld graphs beyond the semicircle law",139,"Spectra of ""real-world"" graphs: beyond the semicircle law.","Many natural and social systems develop complex networks, that are usually modelled as random graphs. The eigenvalue spectrum of these graphs provides information about their structural properties. While the semi-circle law is known to describe the spectral density of uncorrelated random graphs, much less is known about the eigenvalues of real-world graphs, describing such complex systems as the Internet, metabolic pathways, networks of power stations, scientific collaborations or movie actors, which are inherently correlated and usually very sparse. An important limitation in addressing the spectra of these systems is that the numerical determination of the spectra for systems with more than a few thousand nodes is prohibitively time and memory consuming. Making use of recent advances in algorithms for spectral characterization, here we develop new methods to determine the eigenvalues of networks comparable in size to real systems, obtaining several surprising results on the spectra of adjacency matrices corresponding to models of real-world graphs. We find that when the number of links grows as the number of nodes, the spectral density of uncorrelated random graphs does not converge to the semi-circle law. Furthermore, the spectral densities of real-world graphs have specific features depending on the details of the corresponding models. In particular, scale-free graphs develop a triangle-like spectral density with a power law tail, while small-world graphs have a complex spectral density function consisting of several sharp peaks. These and further results indicate that the spectra of correlated graphs represent a practical tool for graph classification and can provide useful insight into the relevant structural properties of real networks."
26,"multistability in the lactose utilization network of escherichia coli",148,"Multistability in the lactose utilization network of Escherichia coli","Multistability, the capacity to achieve multiple internal states in response to a single set of external inputs, is the defining characteristic of a switch. Biological switches are essential for the determination of cell fate in multicellular organisms1, the regulation of cell-cycle oscillations during mitosis2, 3 and the maintenance of epigenetic traits in microbes4. The multistability of several natural1, 2, 3, 4, 5, 6 and synthetic7, 8, 9 systems has been attributed to positive feedback loops in their regulatory networks10. However, feedback alone does not guarantee multistability. The phase diagram of a multistable system, a concise description of internal states as key parameters are varied, reveals the conditions required to produce a functional switch11, 12. Here we present the phase diagram of the bistable lactose utilization network of Escherichia coli13. We use this phase diagram, coupled with a mathematical model of the network, to quantitatively investigate processes such as sugar uptake and transcriptional regulation in vivo. We then show how the hysteretic response of the wild-type system can be converted to an ultrasensitive graded response14, 15. The phase diagram thus serves as a sensitive probe of molecular interactions and as a powerful tool for rational network design."
27,"protein complexes and functional modules in molecular networks",151,"Protein complexes and functional modules in molecular networks","Proteins, nucleic acids, and small molecules form a dense network of molecular interactions in a cell. Molecules are nodes of this network, and the interactions between them are edges. The architecture of molecular networks can reveal important principles of cellular organization and function, similarly to the way that protein structure tells us about the function and organization of a protein. Computational analysis of molecular networks has been primarily concerned with node degree [Wagner, A. & Fell, D. A. (2001) Proc. R. Soc. London Ser. B 268, 1803-1810; Jeong, H., Tombor, B., Albert, R., Oltvai, Z. N. & Barabasi, A. L. (2000) Nature 407, 651-654] or degree correlation [Maslov, S. & Sneppen, K. (2002) Science 296, 910-913], and hence focused on single/two-body properties of these networks. Here, by analyzing the multibody structure of the network of protein-protein interactions, we discovered molecular modules that are densely connected within themselves but sparsely connected with the rest of the network. Comparison with experimental data and functional annotation of genes showed two types of modules: (i) protein complexes (splicing machinery, transcription factors, etc.) and (ii) dynamic functional units (signaling cascades, cell-cycle regulation, etc.). Discovered modules are highly statistically significant, as is evident from comparison with random graphs, and are robust to noise in the data. Our results provide strong support for the network modularity principle introduced by Hartwell et al. [Hartwell, L. H., Hopfield, J. J., Leibler, S. & Murray, A. W. (1999) Nature 402, C47-C52], suggesting that found modules constitute the ""building blocks"" of molecular networks."
28,"finding and evaluating community structure in networks",154,"Finding and evaluating community structure in networks","We propose and study a set of algorithms for discovering community structure in networksnatural divisions of network nodes into densely connected subgroups. Our algorithms all share two definitive features: first, they involve iterative removal of edges from the network to split it into communities, the edges removed being identified using any one of a number of possible ""betweenness"" measures, and second, these measures are, crucially, recalculated after each removal. We also propose a measure for the strength of the community structure found by our algorithms, which gives us an objective metric for choosing the number of communities into which a network should be divided. We demonstrate that our algorithms are highly effective at discovering community structure in both computer-generated and real-world network data, and show how they can be used to shed light on the sometimes dauntingly complex structure of networked systems.We propose and study a set of algorithms for discovering community structure in networksnatural divisions of network nodes into densely connected subgroups. Our algorithms all share two definitive features: first, they involve iterative removal of edges from the network to split it into communities, the edges removed being identified using any one of a number of possible ""betweenness"" measures, and second, these measures are, crucially, recalculated after each removal. We also propose a measure for the strength of the community structure found by our algorithms, which gives us an objective metric for choosing the number of communities into which a network should be divided. We demonstrate that our algorithms are highly effective at discovering community structure in both computer-generated and real-world network data, and show how they can be used to shed light on the sometimes dauntingly complex structure of networked systems."
29,"the structure and function of complex networks",155,"The structure and function of complex networks","Inspired by empirical studies of networked systems such as the Internet, social networks, and bio- logical networks, researchers have in recent years developed a variety of techniques and models to help us understand or predict the behavior of these systems. Here we review developments in this field, including such concepts as the small-world effect, degree distributions, clustering, network correlations, random graph models, models of network growth and preferential attachment, and dynamical processes taking place on networks."
30,"matching words and pictures",156,"Matching words and pictures","We present a new approach for modeling multi-modal data sets, focusing on the specific case of segmented images with associated text. Learning the joint distribution of image regions and words has many applications. We consider in detail predicting words associated with whole images (auto-annotation) and corresponding to particular image regions (region naming). Auto-annotation might help organize and access large collections of images. Region naming is a model of object recognition as a process of translating image regions to words, much as one might translate from one language to another. Learning the relationships between image regions and semantic correlates (words) is an interesting example of multi-modal data mining, particularly because it is typically hard to apply data mining techniques to collections of images. We develop a number of models for the joint distribution of image regions and words, including several which explicitly learn the correspondence between regions and words. We study multi-moda  and correspondence extensions to Hofmann’s hierarchical clustering/aspect model, a translation model adapted from statistical machine translation (Brown et al.), and a multi-modal extension to mixture of latent Dirichlet allocation (MoM-LDA). All models are assessed using a large collection of annotated images of real scenes. We study in depth the difficult problem of measuring performance. For the annotation task, we look at prediction performance on held out data. We present three alternative measures, oriented toward different types of task. Measuring the performance of correspondence methods is harder, because one must determine whether a word has been placed on the right region of an image. We can use annotation performance as a proxy measure, but accurate measurement requires hand labeled data, and thus must occur on a smaller scale. We show results using both an annotation proxy, and manually labeled data."
31,"an overview of audio information retrieval",175,"An overview of audio information retrieval","Abstract.   The problem of audio information retrieval is familiar to anyone who has returned from vacation to find an answering machine full of messages. While there is not yet an ?AltaVista? for the audio data type, many workers are finding ways to automatically locate, index, and browse audio using recent advances in speech recognition and machine listening. This paper reviews the state of the art in audio information retrieval, and presents recent advances in automatic speech recognition, word spotting, speaker and music identification, and audio similarity with a view towards making audio less ?opaque?. A special section addresses intelligent interfaces for navigating and browsing audio and multimedia documents, using automatically derived information to go beyond the tape recorder metaphor."
32,"programmed population control by cellcell communication and regulated killing",186,"Programmed population control by cell–cell communication and regulated killing","De novo engineering of gene circuits inside cells is extremely difficult1, 2, 3, 4, 5, 6, 7, 8, 9, and efforts to realize predictable and robust performance must deal with noise in gene expression and variation in phenotypes between cells10, 11, 12. Here we demonstrate that by coupling gene expression to cell survival and death using cell–cell communication, we can programme the dynamics of a population despite variability in the behaviour of individual cells. Specifically, we have built and characterized a 'population control' circuit that autonomously regulates the density of an Escherichia coli population. The cell density is broadcasted and detected by elements from a bacterial quorum-sensing system13, 14, which in turn regulate the death rate. As predicted by a simple mathematical model, the circuit can set a stable steady state in terms of cell density and gene expression that is easily tunable by varying the stability of the cell–cell communication signal. This circuit incorporates a mechanism for programmed death in response to changes in the environment, and allows us to probe the design principles of its more complex natural counterparts."
33,"mobility in collaboration",205,"Mobility in collaboration","This paper addresses an issue that has received little attention within CSCW - the requirements to support mobility within collaborative activities. By examining three quite different settings each with differing technological support, we examine the ways in which mobility is critical to collaborative work. We suggest that taking mobility seriously may not only contribute our understanding of current support for collaboration, but raise more general issues concerning the requirements for mobile and other technologies."
34,"the sociocognitive psychology of computermediated communication the present and future of technologybased interactions",214,"The sociocognitive psychology of computer-mediated communication: the present and future of technology-based interactions.","The increased diffusion of the Internet has made computer-mediated communication (CMC) very popular. However, a difficult question arises for psychologists and communication researchers: ""What are the communicative characteristics of CMC?"" According to the ""cues-filtered-out"" approach, CMC lacks the specifically relational features (social cues), which enable the interlocutors to identify correctly the kind of interpersonal situations they find themselves in. This paper counters this vision by integrating in its theoretical frame the different psycho-social approaches available in current literature. In particular, the paper describes the characteristics of the socio-cognitive processes-emotional expression, context definition, and identity creation-used by the interlocutors to make order and create relationships out of the miscommunication processes typical of CMC. Moreover, it presents the emerging forms of CMC-instant messaging, shared hypermedia, weblogs, and graphical chats-and their possible social and communicative effects."
35,"oscillations in nfkappab signaling control the dynamics of gene expression",223,"Oscillations in NF-{kappa}B Signaling Control the Dynamics of Gene Expression","Signaling by the transcription factor nuclear factor kappa B (NF-{kappa}B) involves its release from inhibitor kappa B (I{kappa}B) in the cytosol, followed by translocation into the nucleus. NF-{kappa}B regulation of I{kappa}B{alpha} transcription represents a delayed negative feedback loop that drives oscillations in NF-{kappa}B translocation. Single-cell time-lapse imaging and computational modeling of NF-{kappa}B (RelA) localization showed asynchronous oscillations following cell stimulation that decreased in frequency with increased I{kappa}B{alpha} transcription. Transcription of target genes depended on oscillation persistence, involving cycles of RelA phosphorylation and dephosphorylation. The functional consequences of NF-{kappa}B signaling may thus depend on number, period, and amplitude of oscillations. 10.1126/science.1099962"
36,"design of artificial cellcell communication using gene and metabolic networks",226,"Design of artificial cell-cell communication using gene and metabolic networks.","Artificial transcriptional networks have been used to achieve novel, nonnative behavior in bacteria. {T}ypically, these artificial circuits are isolated from cellular metabolism and are designed to function without intercellular communication. {T}o attain concerted biological behavior in a population, synchronization through intercellular communication is highly desirable. {H}ere we demonstrate the design and construction of a gene-metabolic circuit that uses a common metabolite to achieve tunable artificial cell-cell communication. {T}his circuit uses a threshold concentration of acetate to induce gene expression by acetate kinase and part of the nitrogen-regulation two-component system. {A}s one application of the cell-cell communication circuit we created an artificial quorum sensor. {E}ngineering of carbon metabolism in {E}scherichia coli made acetate secretion proportional to cell density and independent of oxygen availability. {I}n these cells the circuit induced gene expression in response to a threshold cell density. {T}his threshold can be tuned effectively by controlling {D}eltap{H} over the cell membrane, which determines the partition of acetate between medium and cells. {M}utagenesis of the enhancer sequence of the gln{A}p2 promoter produced variants of the circuit with changed sensitivity demonstrating tunability of the circuit by engineering of its components. {T}he behavior of the circuit shows remarkable predictability based on a mathematical design model."
37,"initial sequencing and comparative analysis of the mouse genome",229,"Initial sequencing and comparative analysis of the mouse genome.","The sequence of the mouse genome is a key informational tool for understanding the contents of the human genome and a key experimental tool for biomedical research. Here, we report the results of an international collaboration to produce a high-quality draft sequence of the mouse genome. We also present an initial comparative analysis of the mouse and human genomes, describing some of the insights that can be gleaned from the two sequences. We discuss topics including the analysis of the evolutionary forces shaping the size, structure and sequence of the genomes; the conservation of large-scale synteny across most of the genomes; the much lower extent of sequence orthology covering less than half of the genomes; the proportions of the genomes under selection; the number of protein-coding genes; the expansion of gene families related to reproduction and immunity; the evolution of proteins; and the identification of intraspecies polymorphism."
38,"dynamic conditional random fields",230,"Dynamic conditional random fields","Conditional random fields (CRFs) for sequence modeling have several  advantages over joint models such as HMMs, including the ability to  relax strong independence assumptions made in those models, and the  ability to incorporate arbitrary overlapping features. Previous work has  focused on linear-chain CRFs, which correspond to finite-state machines,  and have efficient exact inference algorithms. Often, however, we wish  to label sequence data in multiple interacting ways---for example,..."
39,"large n field theories string theory and gravity",231,"Large N Field Theories, String Theory and Gravity","We review the holographic correspondence between field theories and string/M theory, focusing on the relation between compactifications of string/M theory on Anti-de Sitter spaces and conformal field theories. We review the background for this correspondence and discuss its motivations and the evidence for its correctness. We describe the main results that have been derived from the correspondence in the regime that the field theory is approximated by classical or semiclassical gravity. We focus on the case of the N=4 supersymmetric gauge theory in four dimensions, but we discuss also field theories in other dimensions, conformal and non-conformal, with or without supersymmetry, and in particular the relation to QCD. We also discuss some implications for black hole physics."
40,"the largescale organization of metabolic networks",238,"The large-scale organization of metabolic networks.","In a cell or microorganism, the processes that generate mass, energy, information transfer and cell-fate specification are seamlessly integrated through a complex network of cellular constituents and reactions. {H}owever, despite the key role of these networks in sustaining cellular functions, their large-scale structure is essentially unknown. {H}ere we present a systematic comparative mathematical analysis of the metabolic networks of 43 organisms representing all three domains of life. {W}e show that, despite significant variation in their individual constituents and pathways, these metabolic networks have the same topological scaling properties and show striking similarities to the inherent organization of complex non-biological systems. {T}his may indicate that metabolic organization is not only identical for all living organisms, but also complies with the design principles of robust and error-tolerant scale-free networks, and may represent a common blueprint for the large-scale organization of interactions among all cellular constituents."
41,"functional and topological characterization of protein interaction networks",239,"Functional and topological characterization of protein interaction networks.","The elucidation of the cell's large-scale organization is a primary challenge for post-genomic biology, and understanding the structure of protein interaction networks offers an important starting point for such studies. We compare four available databases that approximate the protein interaction network of the yeast, Saccharomyces cerevisiae, aiming to uncover the network's generic large-scale properties and the impact of the proteins' function and cellular localization on the network topology. We show how each database supports a scale-free, topology with hierarchical modularity, indicating that these features represent a robust and generic property of the protein interactions network. We also find strong correlations between the network's structure and the functional role and subcellular localization of its protein constituents, concluding that most functional and/or localization classes appear as relatively segregated subnetworks of the full protein interaction network. The uncovered systematic differences between the four protein interaction databases reflect their relative coverage for different functional and localization classes and provide a guide for their utility in various bioinformatics studies."
42,"xml bioinformatics and data integration",242,"XML, bioinformatics and data integration.","Motivation: The eXtensible Markup Language (XML) is an emerging standard for structuring documents, notably for the World Wide Web. In this paper, the authors present XML and examine its use as a data language for bioinformatics. In particular, XML is compared to other languages, and some of the potential uses of XML in bioinformatics applications are presented. The authors propose to adopt XML for data interchange between databases and other sources of data. Finally the discussion is illustrated by a test case of a pedigree data model in XML. Contact: Emmanuel.Barillot@infobiogen.fr"
